"Status","Start Time","Stop Time","Duration in ms","Parent Suite","Suite","Sub Suite","Test Class","Test Method","Name","Description"
"passed","Thu Aug 17 13:28:22 GMT 2023","Thu Aug 17 13:28:28 GMT 2023","5525","Surefire suite","Surefire test","com.spotify.oauth2.tests.PlaylistTests","com.spotify.oauth2.tests.PlaylistTests","shouldNotBeAvailableToCreatePlaylistWithoutName","Should not be able to create Playlist without name",""
"passed","Thu Aug 17 13:28:22 GMT 2023","Thu Aug 17 13:28:28 GMT 2023","5608","Surefire suite","Surefire test","com.spotify.oauth2.tests.PlaylistTests","com.spotify.oauth2.tests.PlaylistTests","shouldBeAvailableToGetPlaylist","Should be able to get Playlist","Should be able to get Playlist with correct name, description and public status"
"passed","Thu Aug 17 13:28:22 GMT 2023","Thu Aug 17 13:28:27 GMT 2023","4409","Surefire suite","Surefire test","com.spotify.oauth2.tests.PlaylistTests","com.spotify.oauth2.tests.PlaylistTests","shouldNotBeAvailableToCreatePlaylistWithExpiredToken","Should not be able to create Playlist with expired token",""
"passed","Thu Aug 17 13:28:22 GMT 2023","Thu Aug 17 13:28:28 GMT 2023","5667","Surefire suite","Surefire test","com.spotify.oauth2.tests.PlaylistTests","com.spotify.oauth2.tests.PlaylistTests","shouldBeAvailableToUpdatePlaylist","Should be able to update Playlist","Should be able to update Playlist with correct name, description and public status"
"passed","Thu Aug 17 13:28:22 GMT 2023","Thu Aug 17 13:28:28 GMT 2023","5679","Surefire suite","Surefire test","com.spotify.oauth2.tests.PlaylistTests","com.spotify.oauth2.tests.PlaylistTests","shouldBeAvailableToCreatePlaylist"," Should be able to create Playlist","Should be able to create Playlist with correct name, description and public status"
