"Status","Start Time","Stop Time","Duration in ms","Parent Suite","Suite","Sub Suite","Test Class","Test Method","Name","Description"
"passed","Thu Oct 05 01:03:11 GMT 2023","Thu Oct 05 01:03:17 GMT 2023","5612","Surefire suite","Surefire test","com.spotify.oauth2.tests.PlaylistTests","com.spotify.oauth2.tests.PlaylistTests","shouldNotBeAvailableToCreatePlaylistWithoutName","Should not be able to create Playlist without name",""
"passed","Thu Oct 05 01:03:11 GMT 2023","Thu Oct 05 01:03:17 GMT 2023","5848","Surefire suite","Surefire test","com.spotify.oauth2.tests.PlaylistTests","com.spotify.oauth2.tests.PlaylistTests","shouldBeAvailableToUpdatePlaylist","Should be able to update Playlist","Should be able to update Playlist with correct name, description and public status"
"passed","Thu Oct 05 01:03:11 GMT 2023","Thu Oct 05 01:03:17 GMT 2023","5758","Surefire suite","Surefire test","com.spotify.oauth2.tests.PlaylistTests","com.spotify.oauth2.tests.PlaylistTests","shouldBeAvailableToGetPlaylist","Should be able to get Playlist","Should be able to get Playlist with correct name, description and public status"
"passed","Thu Oct 05 01:03:11 GMT 2023","Thu Oct 05 01:03:16 GMT 2023","4562","Surefire suite","Surefire test","com.spotify.oauth2.tests.PlaylistTests","com.spotify.oauth2.tests.PlaylistTests","shouldNotBeAvailableToCreatePlaylistWithExpiredToken","Should not be able to create Playlist with expired token",""
"passed","Thu Oct 05 01:03:11 GMT 2023","Thu Oct 05 01:03:17 GMT 2023","5838","Surefire suite","Surefire test","com.spotify.oauth2.tests.PlaylistTests","com.spotify.oauth2.tests.PlaylistTests","shouldBeAvailableToCreatePlaylist"," Should be able to create Playlist","Should be able to create Playlist with correct name, description and public status"
