"Status","Start Time","Stop Time","Duration in ms","Parent Suite","Suite","Sub Suite","Test Class","Test Method","Name","Description"
"passed","Fri Mar 22 01:02:35 GMT 2024","Fri Mar 22 01:02:39 GMT 2024","3424","Surefire suite","Surefire test","com.spotify.oauth2.tests.PlaylistTests","com.spotify.oauth2.tests.PlaylistTests","shouldBeAvailableToUpdatePlaylist","Should be able to update Playlist","Should be able to update Playlist with correct name, description and public status"
"passed","Fri Mar 22 01:02:35 GMT 2024","Fri Mar 22 01:02:38 GMT 2024","3351","Surefire suite","Surefire test","com.spotify.oauth2.tests.PlaylistTests","com.spotify.oauth2.tests.PlaylistTests","shouldNotBeAvailableToCreatePlaylistWithoutName","Should not be able to create Playlist without name",""
"passed","Fri Mar 22 01:02:35 GMT 2024","Fri Mar 22 01:02:39 GMT 2024","3482","Surefire suite","Surefire test","com.spotify.oauth2.tests.PlaylistTests","com.spotify.oauth2.tests.PlaylistTests","shouldBeAvailableToCreatePlaylist"," Should be able to create Playlist","Should be able to create Playlist with correct name, description and public status"
"failed","Fri Mar 22 01:02:35 GMT 2024","Fri Mar 22 01:02:39 GMT 2024","3470","Surefire suite","Surefire test","com.spotify.oauth2.tests.PlaylistTests","com.spotify.oauth2.tests.PlaylistTests","shouldBeAvailableToGetPlaylist","Should be able to get Playlist","Should be able to get Playlist with correct name, description and public status"
"passed","Fri Mar 22 01:02:35 GMT 2024","Fri Mar 22 01:02:38 GMT 2024","2659","Surefire suite","Surefire test","com.spotify.oauth2.tests.PlaylistTests","com.spotify.oauth2.tests.PlaylistTests","shouldNotBeAvailableToCreatePlaylistWithExpiredToken","Should not be able to create Playlist with expired token",""
