"Status","Start Time","Stop Time","Duration in ms","Parent Suite","Suite","Sub Suite","Test Class","Test Method","Name","Description"
"passed","Fri Jan 26 01:04:07 GMT 2024","Fri Jan 26 01:04:12 GMT 2024","4584","Surefire suite","Surefire test","com.spotify.oauth2.tests.PlaylistTests","com.spotify.oauth2.tests.PlaylistTests","shouldBeAvailableToCreatePlaylist"," Should be able to create Playlist","Should be able to create Playlist with correct name, description and public status"
"failed","Fri Jan 26 01:04:07 GMT 2024","Fri Jan 26 01:04:12 GMT 2024","4575","Surefire suite","Surefire test","com.spotify.oauth2.tests.PlaylistTests","com.spotify.oauth2.tests.PlaylistTests","shouldBeAvailableToGetPlaylist","Should be able to get Playlist","Should be able to get Playlist with correct name, description and public status"
"passed","Fri Jan 26 01:04:07 GMT 2024","Fri Jan 26 01:04:12 GMT 2024","4392","Surefire suite","Surefire test","com.spotify.oauth2.tests.PlaylistTests","com.spotify.oauth2.tests.PlaylistTests","shouldNotBeAvailableToCreatePlaylistWithoutName","Should not be able to create Playlist without name",""
"passed","Fri Jan 26 01:04:07 GMT 2024","Fri Jan 26 01:04:11 GMT 2024","3648","Surefire suite","Surefire test","com.spotify.oauth2.tests.PlaylistTests","com.spotify.oauth2.tests.PlaylistTests","shouldNotBeAvailableToCreatePlaylistWithExpiredToken","Should not be able to create Playlist with expired token",""
"passed","Fri Jan 26 01:04:07 GMT 2024","Fri Jan 26 01:04:12 GMT 2024","4502","Surefire suite","Surefire test","com.spotify.oauth2.tests.PlaylistTests","com.spotify.oauth2.tests.PlaylistTests","shouldBeAvailableToUpdatePlaylist","Should be able to update Playlist","Should be able to update Playlist with correct name, description and public status"
